Image URL,Title,Article URL,Content,Date,Comments,Read Time,number_of_birders,number_of_observations,number_of_lists,number_of_species,number_of_unique_lists_with_media,names_of_birders,winner_name,how_was_winner_chosen,location_of_challenge,checklist_requirements,extra_condition,tips_or_important_points,bird_species_mentioned
https://birdcount.in/wp-content/uploads/2022/10/2400_1024x576-870x489.jpeg,September 2022 eBirders of the Month,https://birdcount.in/sep22-ebirders/,The challenge for September was to upload at least 30 list with 6 out of 30 lists to be shared lists.  A total of 114 birders met the target.,"Oct 18, 2022",0 Comments,2 min read,2933,440000,28321,949,2820,"[""Aamir Matli"", ""Adarsh Ajay"", ""Adil Ali"", ""Afsar Nayakkan"", ""Akhil S"", ""Alen Alex"", ""Am Amsa"", ""Amee Vyas"", ""Amrit Raha"", ""Anand Shibu"", ""Ananya Deshkar"", ""Aneesh Sasidevan"", ""Ankur Puri"", ""Anonymous Anonymous"", ""Anoop Nair"", ""Anuranjan Singh Dhurwey"", ""Arpit Bansal"", ""Arulvelan Thillainayagam"", ""Arun George"", ""Ashalatha Chevar Kapikad"", ""Ashok Agarwal"", ""Ashwin Viswanathan"", ""Avinash Bhagat"", ""Bhaarat Vyas"", ""Chayan Debnath"", ""Deepali Watve"", ""Dhanapal Kondasamy"", ""Dhruba Saikia"", ""Dipak Sinha"", ""Dipankar Dev"", ""Dipu Karuthedathu"", ""Dr George P J"", ""Dr Mita Gala"", ""Dr. Chetna Ugale"", ""Francis D’Souza"", ""G Lakshmanan"", ""Garima Bhatia"", ""Gaurav Singh"", ""Gireesan Tu"", ""Gokulakrishnan G"", ""Gourav Sonawane"", ""Govind Girija"", ""H Nambiar"", ""Hareesha As"", ""Hari Kumar"", ""Harikrishnan C P"", ""Harish Babu M"", ""Harshith Jv"", ""Jenny Johny Soloman Samuel"", ""Joseph Melkis Raja"", ""Karthik Thrikkadeeri"", ""Karthikeyan R"", ""Kishore P"", ""Krishna Murthy"", ""Krishnamoorthy Muthirulan"", ""Kunan Naik"", ""Lakshmikant Neve"", ""Mahendra Bhil"", ""Manash Pratim"", ""Mandar Chowkekar"", ""Manoj Pai"", ""Mohammed Hirash"", ""Mohan Asampalli"", ""Navya Vyas"", ""Nigin Babu"", ""Nishad Eshaal"", ""Nosherwan Sethna"", ""Nutan Raj"", ""Panchapakesan Jeganathan"", ""Parthasarathi Chakrabarti"", ""Prabhudatta Bal"", ""Praveen Bennur"", ""Praveen J"", ""Premchand Reghuvaran"", ""Rahul Singh"", ""Ramesh Shenai"", ""Reshma Rai"", ""Rofikul Islam"", ""Rowena Robinson"", ""Sahana M"", ""Sakthi Chinnakannu"", ""Samir E"", ""Sandhya Lenka"", ""Santharam V"", ""Saswat Mishra"", ""Seema Tekam"", ""Shashikiran Ganesh"", ""Sheena S"", ""Shilpa Gadgil"", ""Shyamkumar Puravankara"", ""Siva T"", ""Sivakumar Ak"", ""Smita Goyal"", ""Sreehari K Mohan"", ""Sreekanth C"", ""Sreekumar Chirukandoth"", ""Sreelal K Mohan"", ""Steffin Babu"", ""Subhadra Devi"", ""Sudip Simha"", ""Sujith S"", ""Supriya Kulkarni"", ""Tony Antony"", ""Urjit Singh"", ""Vaishnavi S"", ""Venus Joshi"", ""Vidhya Swaminathan"", ""Vidya Chandra"", ""Vijaya Lakshmi"", ""Vikram S"", ""Vinay K L"", ""Vinodkumar Saranathan"", ""Vishal Mistry"", ""Vyom Vyas""]",H Nambiar,drawn using a computer-generated random number,India,at least 30 list with 6 out of 30 lists to be shared lists,,"[""The above list does not include group accounts and those with no identifiable names."", ""Are you doing your best to match\nthe target for October ?"", ""see here for the fresh set of\nyearlong challenges for 2022""]","[""Red Spurfowl"", ""Galloperdix spadicea""]"
https://birdcount.in/wp-content/uploads/2022/09/2400-5_853x682.jpeg,October 2022 eBirding Challenge,https://birdcount.in/oct22-challenge/,"The eBird-India challenge for October is to post at least 40 eligible lists over 31 days of the month. However, at least 5 out of these lists should be uploaded on 8th OctoberWild Bird Day.","Sep 30, 2022",0 Comments,2 min read,,,,800,,,,,India,"Each list should be of minimum 15 minutes or more
complete
lists that includes
counts for all species (no X’s)","at least 40 eligible lists over 31 days of the month. However, at least 5 out of these lists should be uploaded on 8th October.","[""October is an exciting month- festivals are around the corner and the main migration is ramping up."", ""Almost all regions of India are now reporting migrants."", ""Please upload all your lists by 10 November 2022""]","[""Crimson-backed Sunbird""]"
https://birdcount.in/wp-content/uploads/2022/09/2400-2-jaya_749x682.jpeg,August 2022 eBirders of the Month,https://birdcount.in/aug22-ebirders/,"The challenge for August was not just to upload a set number of lists but also to add behaviour comments and breeding codes. A total of 20 birders met the target. From these 20 names, one was drawn using a computer-generated random number. This person is Supriya Kulkarni who receives a copy of The Most Perfect Thing: Inside (and Outside) a Birds Egg by Tim Birkhead as a small gift in appreciation!","Sep 21, 2022",0 Comments,2 min read,2665,350000,21602,881,2214,"[""Amrit Raha"", ""Ashok Agarwal"", ""Chayan Debnath"", ""Debashis Chowdhury"", ""Dhruba Saikia"", ""Dipankar Dev"", ""Gaja Mohanraj"", ""Jenny Johny Soloman Samuel"", ""Lakshmikant Neve"", ""Nitin Srinivasa Murthy"", ""Praveen Bennur"", ""Sahana M"", ""Sharad Apte"", ""Shashikiran Ganesh"", ""Shilpa Gadgil"", ""Shyamkumar Puravankara"", ""Sreekumar Chirukandoth"", ""Sudip Simha"", ""Supriya Kulkarni"", ""V Sitaram""]",Supriya Kulkarni,drawn using a computer-generated random number,India,add behaviour comments and breeding codes,,"[""uploading at least 30 lists"", ""6 out of 30 to be shared with other birders""]","[""Indian Blue Robin""]"
https://birdcount.in/wp-content/uploads/2022/08/2400_1023x682-870x580.jpeg,September 2022 eBirding Challenge,https://birdcount.in/sep22-challenge/,"September 2022 challenge was to upload at least 30 lists, of which, at least 6 should be shared with other eBirders. A total of 114 birders met the target and the winner is  H Nambiar from Kerala.","Aug 27, 2022",1 Comment,2 min read,,,30,,,,,,India,At least 30 eligible lists. At least 6 out of 30 lists should be shared with other eBirders.,all people on the shared checklist were birding together at the same time and place,"[""Checklists must be entered, shared, and accepted by 10th of October 2022""]","[""Rufous-tailed Scrub-Robin""]"
https://birdcount.in/wp-content/uploads/2022/08/2400-3_1023x682-870x580.jpeg,July 2022 eBirders of the Month,https://birdcount.in/jul22-ebirders/,"The eBird monthly challenge for July was to upload at least 31 lists15 lists in the first half of the month and at least 16 lists in the second half. A total of 100 birders met the target. From these 100 names, one was drawn using a computer-generated random number. This person is Tarachand Bairwa who receives a T-shirt (Endemic Birds of India) as a small gift in appreciation.","Aug 24, 2022",0 Comments,2 min read,2542,340000,21657,874,2280,"[""Adil Ali"", ""Ajay Sarvagnam"", ""Am Amsa"", ""Amrit Raha"", ""Anamika Chandran"", ""Ananya Deshkar"", ""Angeline Mano M"", ""Anirban Kundu"", ""Ankush Nirmalkar"", ""Anonymous Anonymous"", ""Anonymous Anonymous"", ""Anuranjan Singh Dhurwey"", ""Arun George"", ""Arun Prabhu"", ""Ashok Agarwal"", ""Ashok Kolluru"", ""Ashwin Viswanathan"", ""Avinash Sharma"", ""Bhavishya C M"", ""Bijoy Venugopal"", ""Chai Eng Law"", ""Chayan Debnath"", ""Cheran Jagadeesan"", ""Debashis Chowdhury"", ""Dhanapal Kondasamy"", ""Dhruba Saikia"", ""Dipak Sinha"", ""Dipankar Dev"", ""Dr. Adil A"", ""Dr. Chetna Ugale"", ""Elavarasan M"", ""Fermin Jose"", ""Francis D’Souza"", ""Gaja Mohanraj"", ""H Nambiar"", ""Hardik Dayal"", ""Harikrishnan C P"", ""Harsha Jayaramaiah"", ""Harshith Jv"", ""Janardhan Uppada"", ""Jayadev Menon"", ""Joseph Melkis Raja"", ""Karthikeyan R"", ""Kishore P"", ""Krishnamoorthy Muthirulan"", ""Krishnendu Das"", ""Lakshmi Bharadwaj"", ""Lakshmikant Neve"", ""Lathika Anoth"", ""Madhu Gupta"", ""Manju Sinha"", ""Manjula Desai"", ""Manoj Kumar Mk1"", ""Mohan Asampalli"", ""Mohit Sahu"", ""Moovendan Ramalingam"", ""Panchapakesan Jeganathan"", ""Parthasarathi Chakrabarti"", ""Prabhudatta Bal"", ""Praveen Bennur"", ""Prem Swaroop Kolluru"", ""Rahul Singh"", ""Rajendra Koranga"", ""Rajesh Radhakrishnan"", ""Ramesh Shenai"", ""Regin Ross"", ""Sahana M"", ""Sajeev Krishnan"", ""Sakthi Chinnakannu"", ""Samir E"", ""Sandhya Lenka"", ""Sanjiv Khanna"", ""Santhi K"", ""Sarabjeet Kaur"", ""Shashikiran Ganesh"", ""Shaurya Rahul Narlanka"", ""Shilpa Gadgil"", ""Shyamkumar Puravankara"", ""Siddharthsinh Sisodiya"", ""Siva T"", ""Snehes Bhoumik"", ""Sreekumar Chirukandoth"", ""Srinivas Mallela"", ""Sriram Reddy"", ""Subhadra Devi"", ""Subramania Siva"", ""Sudip Simha"", ""Sujith Vs"", ""Supriya Kulkarni"", ""Sushant Pawar"", ""Tarachand Bairwa"", ""V Gouthama"", ""Vaishnavi S"", ""Vasen Suli"", ""Vasi "", ""Venus Joshi"", ""Vidhya Swaminathan"", ""Vijaya Lakshmi"", ""Vikrant Prabhulkar"", ""Vivekananda K""]",Tarachand Bairwa,drawn using a computer-generated random number,India,at least 31 lists– 15 lists in the first half of the month and at least 16 lists in the second half,These are excluding group accounts and those with no identifiable name,"[""uploading at least 20 lists with behaviour comments and breeding codes""]","[""Speckled Piculet""]"
https://birdcount.in/wp-content/uploads/2022/07/2400-btbe_1023x682-870x580.jpeg,August 2022 eBirding Challenge,https://birdcount.in/aug22-challenge/,"eBird-India monthly challenge for August is to upload 20 or more eligible lists containing at least one species with comments on its behaviour. In addition to this, any 10 lists among the 20 should have at least one breeding code.","Jul 30, 2022",1 Comment,2 min read,,,,,,,,,India,"Eligible checklists are those that report all species seen/heard (and are therefore marked ‘complete’), report numbers for all species rather than Xs, and are of at least 15 minutes or longer in duration.","upload 20 or more eligible lists containing at least one species with comments on its behaviour. In addition to this, any 10 lists among the 20 should have at least one breeding code.","[""maintain a suitable distance"", ""don’t use playback"", ""don’t trample habitats where birds are likely to nest"", ""delay adding your comments or photographs for a few weeks if you fear that others may notice your observations and disturb the birds you have seen nesting"", ""follow the basic principles of birding ethics, including in photography""]","[""Blue-tailed Bee-eater"", ""Merops philippinus""]"
https://birdcount.in/wp-content/uploads/2022/07/2400-emerald-cuckoo_1022x682-870x581.jpeg,June 2022 eBirders of the Month,https://birdcount.in/jun22-ebirders/,"June saw less birding compared to May. It could be because of the heat or rains in many places or the absence of birding events. Before moving on to the results for the monthly challenges, here is a brief glimpse of birding in June by the numbers (with the previous...","Jul 20, 2022",0 Comments,3 min read,2872,440000,29340,908,2593,"[""Abu Birder"", ""Adarsh Ajay"", ""Adil Ali"", ""Ajay Sarvagnam"", ""Alen Alex"", ""Alok Nagdev"", ""Am Amsa"", ""Amee Vyas"", ""Amitabh Chhajlani"", ""Amrit Raha"", ""Anamika Chandran"", ""Ananya Deshkar"", ""Ananyaa Dobhal"", ""Angeline Mano M"", ""Anirban Kundu"", ""Anjali Bhaskar"", ""Anjali Krishna"", ""Ankita Shukla"", ""Ankush Nirmalkar"", ""Anoop Nair"", ""Anuj Saikia"", ""Anuranjan Singh Dhurwey"", ""Archana Jha"", ""Arun Prabhu"", ""Ashish Bareth"", ""Ashok Agarwal"", ""Ashok Kolluru"", ""Ashwin Viswanathan"", ""Ayan Yogesh Watve"", ""Bamin Chada"", ""Bharatendra Singh Parihar"", ""Bhavishya C M"", ""Bijoy Venugopal"", ""Chai Eng Law"", ""Chandrasen Kori"", ""Chayan Debnath"", ""Cheran Jagadeesan"", ""Chintan Sheth"", ""Chitra Shanker"", ""Debashis Chowdhury"", ""Deepak Gujar"", ""Deepali Watve"", ""Devarajan Narayanan"", ""Dhanapal Kondasamy"", ""Dhruba Saikia"", ""Dipankar Dev"", ""Dr Jishnu R"", ""Dr Mohammed Umer Sharieff"", ""Dr. Adil A"", ""Dr. Archana Shukla"", ""Dr. Chetna Ugale"", ""Elavarasan M"", ""Gaja Mohanraj"", ""Garima Bhatia"", ""Gopi Krishnamurthy"", ""H Nambiar"", ""Hardik Dayal"", ""Harikrishnan C P"", ""Harish Dobhal"", ""Harsha Jayaramaiah"", ""Harshith Jv"", ""Hemanya Radadia"", ""Ikshan Ganpathi"", ""Janardhan Uppada"", ""Janhvi Gupta"", ""Jayadev Menon"", ""Jim Panwar"", ""Joseph Melkis Raja"", ""Karthik Thrikkadeeri"", ""Karthikeyan R"", ""Khalid Khan"", ""Kiran Pardeshi"", ""Kishore P"", ""Koj Mama"", ""Krishna Prasad Ramanand"", ""Lakshmikant Neve"", ""Lathika Anoth"", ""Loukika Neve"", ""Madhu Gupta"", ""Mani Mk"", ""Manish Kewat"", ""Manjula Desai"", ""Manoj Jain"", ""Manoj Karingamadathil"", ""Manoj Kumar Mk1"", ""Manoj Pai"", ""Maria Fernandes"", ""Mariam Ahmed"", ""Mehala Kumar"", ""Meruva Naga Rajesh"", ""Milind Sawdekar"", ""Mohan Asampalli"", ""Mohit Sahu"", ""Moovendan Ramalingam"", ""Mrunali Raut"", ""Mukundan Kizhakkemadham"", ""Navya Vyas"", ""Nigin Babu"", ""Nitin Hunnalli"", ""Nitish Gupta"", ""Panchapakesan Jeganathan"", ""Parthasarathi Chakrabarti"", ""Prabhudatta Bal"", ""Pradhyumn Yadav"", ""Prakruthi Gm"", ""Pranad Patil"", ""Praveen Bennur"", ""Praveen Velayudhan"", ""Prem Swaroop Kolluru"", ""Rahul Singh"", ""Rajendra Koranga"", ""Rajesh Panwar"", ""Rajesh Prasad"", ""Ramaswamy V"", ""Ramesh Shenai"", ""Ramit Singal"", ""Ramnarayan Kalyanaraman"", ""Regin Ross"", ""Renju Tr"", ""Reshma Rai"", ""Revathi Cm"", ""Rohit Kokil"", ""Rudresh Parsekar"", ""Sahana M"", ""Sailendra Punukollu"", ""Sajeev Krishnan"", ""Sakthi Chinnakannu"", ""Samir E"", ""Samish Dhongle"", ""Sandeep Nayak"", ""Sandhya Lenka"", ""Sanjay Pawar"", ""Sanjiv Khanna"", ""Santhi K"", ""Sarabjeet Kaur"", ""Seema Tekam"", ""Sharad Apte"", ""Shashikiran Ganesh"", ""Shaurya Rahul Narlanka"", ""Shilpa Gadgil"", ""Shino Jacob Koottanad"", ""Shyamkumar Puravankara"", ""Siva T"", ""Snehes Bhoumik"", ""Sreekumar Chirukandoth"", ""Srinivas Mallela"", ""Steffin Babu"", ""Subhadra Devi"", ""Sudip Simha"", ""Sujith Vs"", ""Supriya Kulkarni"", ""Susanta Mukherjee"", ""Sushant Pawar"", ""Tarachand Bairwa"", ""Urjit Singh"", ""Vaibhav Patil"", ""Vaishnavi S"", ""Vasen Suli"", ""Vasi"", ""Venkatesh S"", ""Venus Joshi"", ""Vidhya Sundar"", ""Vidhya Swaminathan"", ""Vijaya Lakshmi"", ""Vikrant Prabhulkar"", ""Vinay K L"", ""Vishal Mistry"", ""Vivek Rawat"", ""Vivekananda K"", ""Vyom Vyas""]",Deepak Gujar,drawn using a computer-generated random number,India,"submit 30 eligible checklists, with at least three of them containing a brood-parasitic cuckoo",These are excluding group accounts and those with no identifiable name,"[""June saw less birding compared to May. It could be because of the heat or rains in many places or the absence of birding events."", ""Are you birding towards the July 2022 eBird challenge– spreading your birding throughout 31 days of July in a certain way"", ""there are also the yearlong challenges for 2022""]","[""Asian Emerald Cuckoo"", ""Chrysococcyx maculatus""]"
https://birdcount.in/wp-content/uploads/2022/06/2400-2_868x682.jpeg,July 2022 eBirding Challenge,https://birdcount.in/jul22-challenge/,It can be easy to let birding activity slip into a bit of a lull in July as the monsoon makes its presence felt across much of the country. But the rains are hardly a reason to cut down on watching birds! A number of interesting observations can be made during this...,"Jun 30, 2022",0 Comments,2 min read,,,31,,,,,,India,minimum of 31 eligible checklists of at least 15 minutes duration,"31 lists should be spread in such a way that you have at least 15 lists in the first half of the month (1-15 July), and at least 16 lists in the second half (16-31 July)","[""consider adding sounds, photos, and behavioural comments"", ""If you are observing/documenting breeding birds please follow these practices: maintain a suitable distance; don’t use playback; don’t trample habitats where birds are likely to nest"", ""If you fear that others may notice your observations and disturb the birds you have seen nesting, you can delay adding your comments or photographs for a few weeks"", ""Please follow the basic principles of birding ethics, including in photography""]","[""Pittas"", ""Orioles"", ""Ashy Prinia""]"
https://birdcount.in/wp-content/uploads/2022/06/2400_909x682-870x653.jpeg,May 2022 eBirders of the Month,https://birdcount.in/may22-ebirders/,"May is usually the month with the lowest birding activity in India, however many birders were out birding braving the high temperatures and heavy rains in some regions. Here is the breakup of birding in India in the month of May 2022 (with the previous month in...","Jun 23, 2022",0 Comments,2 min read,3535,560000,34084,1019,3278,"[""Adil Ali"", ""Ajay Sarvagnam"", ""amrit raha"", ""Angeline Mano M"", ""Anuj Saikia"", ""ANURANJAN SINGH DHURWEY"", ""Arpit Bansal"", ""Ashok Agarwal"", ""Chayan Debnath"", ""Cheran Jagadeesan"", ""DEVARAJAN NARAYANAN"", ""Dhruba Saikia"", ""Dr Mohammed Umer Sharieff"", ""Gaja mohanraj"", ""Janardhan Uppada"", ""Jayadev Menon"", ""JOSEPH MELKIS RAJA"", ""Lakshmikant Neve"", ""Manju Sinha"", ""Manjula Desai"", ""MANOJ KUMAR MK1"", ""Moovendan Ramalingam"", ""Neelakantan KK"", ""Panchapakesan Jeganathan"", ""Praveen Bennur"", ""Prem swaroop Kolluru"", ""Rahul Pereira"", ""Rajendra Koranga"", ""Ramesh Shenai"", ""Ramnarayan Kalyanaraman"", ""Regin Ross"", ""Sakthi Chinnakannu"", ""Sarabjeet Kaur"", ""Shashikiran Ganesh"", ""Shilpa Gadgil"", ""shyamkumar puravankara"", ""Steffin Babu"", ""Subhadra Devi"", ""Sushant Pawar"", ""Vaishnavi S"", ""VASI"", ""Vidhya Sundar"", ""Vidhya Swaminathan"", ""Vijaya Lakshmi"", ""Vikrant Prabhulkar"", ""Vivekananda K""]",Adil Ali,one was drawn using a computer-generated random number,India,at least 35 checklists in a certain way so that it could add value to the 3 one-day birding events,All lists uploaded on the 14th of May were counted for India’s Endemic Bird Day and Global Big Day.,"[""May is usually the month with the lowest birding activity in India"", ""June 2022 eBird challenge– to submit 30 eligible checklists*, with at least three of them containing a brood-parasitic cuckoo""]","[""Grey Wagtail"", ""Motacilla cinerea""]"
https://birdcount.in/wp-content/uploads/2022/05/Common-Cuckoo-Albin-Jacob_1024x576-870x489.jpg,June 2022 eBirding Challenge,https://birdcount.in/jun22-challenge/,"June is the time when both resident and migratory cuckoos are active and searching for potential sites where the host birds are likely to nest. In the Himalaya, Large Hawk-Cuckoo, Himalayan Cuckoo, Common Cuckoo have been vocal since May, and in northeast India its...","May 28, 2022",0 Comments,2 min read,,,,,,,,,India,"Eligible checklists are those that report all species seen/heard (and are therefore marked ‘complete’), report numbers for all species rather than Xs, and are of at least 15 minutes or longer in duration.","submit 30 eligible checklists, with at least three of them containing a brood-parasitic cuckoo.","[""do consider adding sounds, photos, and behavioural comments"", ""maintain a suitable distance"", ""don’t use playback"", ""don’t trample habitats where birds are likely to nest"", ""delay adding your comments or photographs for a few weeks if you fear that others may notice your observations and disturb the birds you have seen nesting"", ""Please follow the basic principles of birding ethics, including in photography"", ""ensure that you adhere to COVID-19 related instructions by central and local authorities""]","[""Large Hawk-Cuckoo"", ""Himalayan Cuckoo"", ""Common Cuckoo"", ""Hodgson’s Hawk-Cuckoo"", ""Plaintive Cuckoo"", ""Banded Bay Cuckoo"", ""Square-tailed Drongo Cuckoo""]"
https://birdcount.in/wp-content/uploads/2022/05/2400-nipi_946x682-870x627.jpeg,April 2022 eBirders of the Month,https://birdcount.in/apr22-ebirders/,"As the temperature rises in most parts of India, April tends to see a further drop in birding activity. Here is the breakup of birding in India in the month of April 2022 (with the previous month in brackets): No. of birders: 3,339 (3,985) Number of observations:...","May 21, 2022",0 Comments,3 min read,3339,560000,33406,1059,3825,"[""Able Lawrence"", ""Albin Jacob"", ""Ambady Sasi"", ""Anbu Damodaran"", ""Angeline Mano M"", ""Anish Bera"", ""Arijit Banerjee"", ""Arpan Saha"", ""Arpit Bansal"", ""Arulvelan Thillainayagam"", ""Arun Prabhu"", ""Ashok Agarwal"", ""Bharatendra Singh Parihar"", ""Bijoy Venugopal"", ""Chandan Dalawat"", ""Chandrika Khirani"", ""Charles Thomas"", ""Chitra Shanker"", ""Cyril Duran"", ""Dean LaTray"", ""Debashis Chowdhury"", ""Deepak Gujar"", ""Dhruba Saikia"", ""Dipankar Dev"", ""Doug Gochfeld"", ""Dr Mohammed Umer Sharieff"", ""Francis D’Souza"", ""Gaja mohanraj"", ""George Kuriakose Basil"", ""Girish Chhatpar"", ""Girish Chonkar"", ""H Nambiar"", ""Hardik Dayal"", ""Hemanya Radadia"", ""Hiren Khambhayta"", ""Ikshan Ganpathi"", ""Jörg Hanoldt"", ""Janardhan Uppada"", ""Jeff Harding"", ""John Longhenry"", ""Karan Matalia"", ""Karthik Thrikkadeeri"", ""Kavi Nanda"", ""Krishnamoorthy Muthirulan"", ""Kusumita Medhekar"", ""Lakshmikant Neve"", ""Manaswini Ghosal"", ""Maneesh Rajvanshi"", ""mathew thekkethala"", ""Mohan Asampalli"", ""Munna Mandalapu"", ""Nishant Bhagwat"", ""Nitin Chandra"", ""Padma Gyalpo"", ""Peter Kaestner"", ""Pradnyavant Mane"", ""Praveen Bennur"", ""Praveen Chavan"", ""Prem swaroop Kolluru"", ""Priyam & Atul"", ""Raghavendra Pai"", ""Rahul Singh"", ""Rahul Pereira"", ""Rajesh Radhakrishnan"", ""Rajkumar Das"", ""Raju Kasambe"", ""Ramesh Desai"", ""Ramesh Shenai"", ""Ranjeet Singh"", ""Sadashiv Pujari"", ""Sahana M"", ""Samarth Shadakshari"", ""Samim Akhter"", ""Sandeep Biswas"", ""Sanjiv Khanna"", ""Santhi K"", ""Sarabjeet Kaur"", ""Savithri Singh"", ""Shantanu Majumdar"", ""Sharad Apte"", ""Shashikiran Ganesh"", ""Shekar Vishvanath"", ""Shilpa Gadgil"", ""Shreyas Punacha"", ""shyamkumar puravankara"", ""Sitendu Goswami"", ""Siva T"", ""Sreekumar Chirukandoth"", ""Steffin Babu"", ""Subhadra Devi"", ""Sudip Simha"", ""Sujith S"", ""sujith vs"", ""Suren Akkaraju"", ""Swapan Bhattacharjee"", ""SWARUP SAHA"", ""Tushar Agarwal"", ""Umesh Sharma"", ""Utsav Biswas"", ""V Sitaram"", ""Venus Joshi"", ""Vidhya Swaminathan"", ""Vijaya Lakshmi"", ""Vineeta Dixit"", ""Vivek Saggar"", ""Vivek Sudhakaran"", ""Vyomkesh Buch"", ""Yogesh More""]",Suren Akkaraju,drawn using a computer-generated random number,India,,upload 20 or more rated photos or audio recordings to your April 2022 checklists,"[""Are you birding towards the May 2022 eBird challenge–\naggregating at least 35 eligible* checklists throughout the month?""]","[""Nilgiri Pipit""]"
https://birdcount.in/wp-content/uploads/2022/04/2400-Neeraja_1023x682-870x580.jpeg,May 2022 eBirding Challenge,https://birdcount.in/may22-challenge/,"Though the soaring temperatures in May might make you uncomfortable going out birding it's still one of the best times of the year to watch breeding behaviour. There are also 3 one-day events happening in May Endemic Bird Day, Himalayan Bird Count and Global Big...","Apr 28, 2022",0 Comments,2 min read,,,,,,,,,India,"Eligible checklists are those that report all species seen/heard (and are therefore marked ‘complete’), report numbers for all species rather than Xs, and are of at least 15 minutes or longer in duration.",At least 35 eligible checklists throughout the month. At least thirteen lists from 1st- 13th May (minimum 1 list each day). At least five lists on 14th May. At least seventeen lists from 15th- 31st May (minimum 1 list each day),"[""Whenever you see birds showing any signs of breeding, choose the breeding behaviour codes."", ""While birding, please ensure that you adhere to COVID-19 related instructions by central and local authorities."", ""Please upload all your lists by 10 June 2022""]","[""Eurasian Coot""]"
https://birdcount.in/wp-content/uploads/2022/04/2400-sneha-gupta_1024x682-870x579.jpeg,March 2022 eBirders of the Month,https://birdcount.in/mar22-ebirders/,"After much birding in January and February, birding generally drops a bit in March. Let's look at the break-up of eBirding in India in March (with the previous month in brackets). No. of birders: 3,985 (5,708) Number of observations: 7.9 lakh (11.9 lakh) Number of...","Apr 20, 2022",0 Comments,2 min read,3985,790000,47010,1104,4667,"[""Ajay Sarvagnam"", ""Ajay Sivakumar"", ""Ashok Agarwal"", ""Ashwin Viswanathan"", ""Deepak Gujar"", ""Dhruba Saikia"", ""Dr Mohammed Umer Sharieff"", ""Dr. Adil A"", ""Gaja Mohanraj"", ""Garima Bhatia"", ""Hardik Dayal"", ""Janardhan Uppada"", ""Karthik Thrikkadeeri"", ""Krishnamoorthy Muthirulan"", ""Lakshmikant Neve"", ""Pazhani Manivannan"", ""Praveen Bennur"", ""Rahul Singh"", ""Ramesh Shenai"", ""Rowena Robinson"", ""Sahana M"", ""Sanjiv Khanna"", ""Sarabjeet Kaur"", ""Shashikiran Ganesh"", ""Shilpa Gadgil"", ""Sreekumar Chirukandoth"", ""Srinivas Mallela"", ""Steffin Babu"", ""Subhadra Devi"", ""Sudip Simha"", ""Sujith VS"", ""Utsav Biswas"", ""Vaishnavi S"", ""Venus Joshi"", ""Vidhya Swaminathan""]",Shilpa Gadgil,drawn using a computer-generated random number,India,at least 31 lists out of which 2 should be from 2 different hotspots where you eBirded during the previous three months (December 2021 to February 2022),at least 8 of your lists should also have breeding codes,"[""uploading 20 or more rated photos or audio recordings to your April 2022 checklists""]","[""Indian Spot-billed Duck""]"
