Image URL,Title,Article URL,Content,Date,Comments,Read Time,number_of_birders,number_of_observations,number_of_lists,number_of_species,number_of_unique_lists_with_media,names_of_birders,winner_name,how_was_winner_chosen,location_of_challenge,checklist_requirements,extra_condition,tips_or_important_points,bird_species_mentioned
https://birdcount.in/wp-content/uploads/2019/07/167118021-lakshmikant-Neve-cropped-1-870x443.jpg,June 2019 eBirders of the month,https://birdcount.in/jun19-ebirders/,"June is an odd month when parts of India are still reeling in the heat and other parts see heavy rain -- neither very conducive to birding. Still, you can't keep birders away from birding! Here is the breakup of eBirding in the country in June 2019 (with previous...","Jul 16, 2019",1 Comment,2 min read,1430,190000,11400,,,"[""ADIL NAFAR"", ""Ajay Gadikar"", ""Amal U S"", ""AM AMSA"", ""Andrew Spencer"", ""Angeline Mano"", ""Aravind AM"", ""Arulvelan Thillainayagam"", ""Arvind Yadav"", ""Ashwin Viswanathan"", ""Ayyanna TH"", ""Baseer Baniya"", ""B.R. Ansil"", ""Chayant Gonsalves"", ""Chitra Shanker"", ""Civin Solomon"", ""Claudia Pinheiro"", ""Debanjan Sarkar"", ""Deepti Krishnan"", ""Dhananjai Mohan"", ""Dhruba Saikia"", ""Dr George P J"", ""Dr. NISHAD PM"", ""Elavarasan"", ""M GOVIND GIRIJA"", ""Hakimuddin F Saify"", ""Hareesha AS"", ""hari kumar"", ""Harish Dobhal"", ""Harshith JV"", ""HARSHJEET BAL"", ""Hemant Ware"", ""Irshad Theba"", ""irvin calicut"", ""Janardhan Uppada"", ""Jayadev Menon"", ""Jishnu Narayanan"", ""JOE M RAJA"", ""KARTHIKEYAN R"", ""Kishore P"", ""Lakshmikant Neve"", ""Lakshminarasimha Ranganathan"", ""Lathika K K"", ""Malyasri Bhattacharya"", ""Manju Sinha"", ""manoj p g"", ""MAXIM RODRIGUES K"", ""Meena Balgopal"", ""Mehala Kumar"", ""MetalClicks Ajay Ashok"", ""Mittal Gala"", ""Narendran M.M"", ""Nitu S"", ""Panchapakesan Jeganathan"", ""PANKAJ GUPTA"", ""Paul Ode"", ""Prabhudatta Bal"", ""pradeep chandran a j"", ""Premchand Reghuvaran"", ""Pushpa Puliyeri"", ""Rahul Singh"", ""Rajarajan V"", ""Rajesh Panwar"", ""Rajesh Prasad"", ""Rajesh Radhakrishnan"", ""Ramaswamy V"", ""Ramesh Desai"", ""Ramnarayan K"", ""Regin Ross"", ""Renju TR"", ""Rohan Chakravarty"", ""Roshan Tamang"", ""Sahana M"", ""Sajeev Krishnan"", ""Sandhya Lenka"", ""Santharam V"", ""Selvaganesh K"", ""sheeba nanjan"", ""Sheena S"", ""Shilpa Gadgil"", ""Shuvendu Das"", ""SRINILA MAHESH K T"", ""Sriram Reddy"", ""Steffin Babu"", ""Subhadra Devi"", ""Suhel Quader"", ""S ~ V I S H N U S A N K A R"", ""Taukeer Alam Lodha"", ""Tushar Agarwal"", ""vadivukkarasi A"", ""VASEN SULI"", ""Vidhya Swaminathan"", ""Vijaya Lakshmi"", ""Vinay K L"", ""Vinay Nadig"", ""Vinod Shankar"", ""Virender Sharma"", ""Vivek Puliyeri""]",Lakshmikant Neve,drawn using a computer-generated random number,India,"at least 30 lists, 3 of which report a brood-parasitic cuckoo",excluding group accounts,"[""target for July (10 shared birdlists)"", ""yearlong challenges for 2019""]","[""Scaly-breasted Munia""]"
https://birdcount.in/wp-content/uploads/2019/06/RC1_1b-1-870x427.jpg,July 2019 eBirding Challenge,https://birdcount.in/jul19-challenge/,"July brings the monsoon in full swing - clouds full of rain hang above, usually accompanied by thunder, lightning and strong winds. With the rains, the bare lands are transformed into lush grasslands and many species such as rain quails, bush-quails, and black...","Jun 30, 2019",0 Comments,2 min read,,,10,,,"[""Rahul Singh""]",,,,10 complete lists that are shared with at least two other people,all people on the shared checklist should be birding together and sharing with group accounts does not count for this challenge,"[""if you are new to eBird, please read this description first"", ""take a look at our quick-start infographic"", ""take a look at the more comprehensive Beginner’s Guide""]","[""rain quails"", ""bush-quails"", ""black francolins"", ""painted francolins"", ""bitterns"", ""watercocks"", ""rails"", ""crakes"", ""Rain Quail""]"
https://birdcount.in/wp-content/uploads/2019/06/Screenshot-from-2019-06-19-12-55-08-870x347.png,May 2019 eBirders of the month,https://birdcount.in/may19-ebirders/,"Most of India reels under the hear in the month of May, and this is typically not a month in which birders are particularly active (apart from in the mountains). Still, an impressive amount of eBirding took place this May. Here is the breakup of eBirding in the...","Jun 19, 2019",0 Comments,1 min read,1600,240000,14600,,,"[""Aravind AM"", ""Dhruba Saikia"", ""HARSHJEET BAL"", ""Janardhan Uppada"", ""Jayadev Menon"", ""KARTHIKEYAN R"", ""Lakshmikant Neve"", ""Pravar Mourya"", ""Rajesh Radhakrishnan"", ""Regin Ross"", ""Sheena S"", ""Shuvendu Das"", ""Steffin Babu"", ""Subhadra Devi"", ""Vidhya Swaminathan""]",Sheena S,drawn using a computer-generated random number,India,upload at least 30 eligible lists that have one or more breeding codes,,"[""match the target for June (30 checklists, 3 with brood-parasitic cuckoos)"", ""yearlong challenges for 2019""]","[""Red-necked Phalarope""]"
https://birdcount.in/wp-content/uploads/2019/05/LHC_2-crop-e1559118398110-870x651.jpg,June 2019 eBirding Challenge,https://birdcount.in/jun19-challenge/,"Bird watchers may have taken refuge in the cooler interiors of their homes during the hot month of May but a number of resident birds went about their business of breeding in the heat. In many parts of India, June can still be hot but not for long. Dark clouds will...","May 31, 2019",0 Comments,2 min read,,,,,,,,,India,"Submit 30 eligible checklists, with at least three of them containing a brood-parasitic cuckoo.",Add appropriate ‘breeding codes’,"[""All lists should be uploaded by 10 July 2019"", ""if you are new to eBird, please read this description first, and do take a look at our quick-start infographic and also the more comprehensive Beginner’s Guide""]","[""tailor birds"", ""babblers"", ""sunbirds"", ""ioras"", ""bitterns"", ""rails"", ""quails"", ""cuckoos"", ""Large Hawk-cuckoo""]"
https://birdcount.in/wp-content/uploads/2019/05/91432691-Great-Barbet-Saurabh-Sawant-870x580.jpg,April 2019 eBirders of the month,https://birdcount.in/apr19-ebirders/,"April is an interesting month for birding. Many remaining winter migrants are on their way back, and breeding activity is widespread among residents and summer visitors. Here is the breakup of eBirding in the country in April 2019 (with previous month in brackets):...","May 17, 2019",0 Comments,2 min read,1746,300000,17000,,,"[""AAKIB HUSSAIN"", ""Adil Ali"", ""ADIL NAFAR"", ""Afthab Faisal k"", ""Ains Priestman"", ""Amal U S"", ""AM AMSA"", ""Andrew Spencer"", ""Andy Walker"", ""Angeline Mano"", ""Ankit Vikrant"", ""Aravind AM"", ""Aravind Amirtharaj"", ""Arjun R"", ""Ashwin Viswanathan"", ""Bhanu Sridharan"", ""B.R. Ansil"", ""Chirag Solanki"", ""Chitra Shanker"", ""Claudia Pinheiro"", ""Deepti Krishnan"", ""Dhananjai Mohan"", ""Dhruba Saikia"", ""Dipu Karuthedathu"", ""Divin Venu"", ""Elavarasan M"", ""fermin jose"", ""Ghani Singh"", ""Gillian Wright"", ""Glenn Giacinto"", ""GOVIND GIRIJA"", ""Hakimuddin F Saify"", ""Hareesha AS"", ""hari kumar"", ""Harish Dobhal"", ""Harshith JV"", ""HARSHJEET BAL"", ""Hemant Ware"", ""Howard Laidlaw"", ""Irshad Theba"", ""Jageshwer verma"", ""Janardhan Uppada"", ""Jayadev Menon"", ""Jishnu Narayanan"", ""JOE M RAJA"", ""KARTHIKEYAN R"", ""Kshitija Gupta"", ""Lakshmikant Neve"", ""Lathika K K"", ""Manju Sinha"", ""manoj p g"", ""Meghana Natesh"", ""Mehala Kumar"", ""Mohanan Choron"", ""Narendran M.M"", ""Panchapakesan Jeganathan"", ""Peter Boesman"", ""Prabhudatta Bal"", ""Prachi Thatte"", ""Praveen es"", ""Praveen J"", ""Premchand Reghuvaran"", ""Pushpa Puliyeri"", ""Rajarajan V"", ""Rajesh Prasad"", ""Rajesh Radhakrishnan"", ""Ramakrishnan Kumaranallur"", ""Raman Kumar"", ""Ramesh Desai"", ""Ramit Singal"", ""Ramnarayan K"", ""Regin Ross"", ""Renju TR"", ""Sahana M"", ""Sajeev Krishnan"", ""Sandhya Lenka"", ""Sandip Das"", ""Santharam V"", ""Saurabh Sawant"", ""Selvaganesh K"", ""Sheena S"", ""Shilpa Gadgil"", ""Sreekumar Chirukandoth"", ""Sreekumar E R"", ""SRINILA MAHESH K T"", ""Sriram Reddy"", ""Steffin Babu"", ""Subbu Subramanya"", ""Subhadra Devi"", ""subramania siva"", ""S – V I S H N U S A N K A R"", ""SYAMILI MANOJ"", ""Taukeer Alam Lodha"", ""Ted Wolff"", ""vaazhaikumar kumar"", ""vadivukkarasi A"", ""VASEN SULI"", ""Vidhya Swaminathan"", ""Vidya Raju"", ""Vijay Ramachandran"", ""Vijay Rj"", ""Vinay Das"", ""Vinay K L"", ""viral joshi"", ""Vivek Puliyeri""]",Saurabh Sawant,Eligible checklists of all the people listed above were put into a pool and one list with an audio recording was drawn using a computer-generated random number.,India,at least 30 eligible lists,one list with an audio recording,"[""target for May (30 checklists with breeding codes)"", ""yearlong challenges for 2019""]","[""Great Barbet""]"
https://birdcount.in/wp-content/uploads/2019/04/SPD_001-e1556612440107-870x434.jpg,May 2019 eBirding Challenge,https://birdcount.in/may19-challenge/,"Have you ever seen a female Barred Buttonquail fighting with another female, to defend her mate? Have you ever seen how babblers react in the presence of a brood parasitic cuckoo? Or how males in many species provide nutrients to a female, as pre-copulatory food...","Apr 30, 2019",2 Comments,2 min read,,,,,,"[""Aravind AM""]",,,India,Minimum of 30 checklists containing at least one breeding code. Each list should be at least 15 mins and complete with no ‘X’.,“F – Flyover” will not count for this challenge,"[""Adding sounds, photos, and behavioural comments"", ""maintain a suitable distance"", ""don’t use playback"", ""don’t trample habitats where birds are likely to nest"", ""follow the basic principles of birding ethics, including in photography"", ""tips on how to go about birding in hot weather""]","[""Barred Buttonquail"", ""Indian Spot-billed Duck""]"
https://birdcount.in/wp-content/uploads/2019/04/88969331-Verditer-Flycatcher-Abhishek-Das-1-870x490.jpg,March 2019 eBirders of the month,https://birdcount.in/mar19-ebirders/,"Birding activity in India usually drops from February (with the GBBC) to March, and this year was no different. Here is the breakup of eBirding in the country in March 2019 (with previous month in brackets): Number of birders: 2,227 (2,916)Number of lists (all...","Apr 18, 2019",0 Comments,2 min read,2227,433000,24000,,,"[""Abdul Rehim"", ""Abhijith surendran"", ""ADIL NAFAR"", ""AFREED MUHAMMED N V"", ""Alagananda CR"", ""Ananthu Vijayakrishnan"", ""Anish Aravind"", ""Ankit Vikrant"", ""Aravind AM"", ""Aravind Amirtharaj"", ""Arjun T S"", ""Arshad Kooriyadan"", ""Arun B"", ""ashok raj v m"", ""Devika Ps"", ""Divin Venu"", ""Dr George P J"", ""Elcira Villarreal"", ""Gireesan TU"", ""GIRISHKUMAR K"", ""GOVIND GIRIJA"", ""HARI MAVELIKARA"", ""Jaichand Johnson"", ""Jeanette Frazier"", ""Jishnu Narayanan"", ""KARTHIKEYAN R"", ""krishnakumar K Iyer"", ""Lakshmikant Neve"", ""Lathika K K"", ""Marta Curti"", ""Mohammed Rinaz.m"", ""Najeeb K"", ""Nehal Gurung"", ""Nesrudheen PP"", ""Nitu S"", ""Nosherwan Sethna"", ""Omkar Dharwadkar"", ""Panchapakesan Jeganathan"", ""Pravar Mourya"", ""Premchand Reghuvaran"", ""PRIYA AV"", ""Pushpa Puliyeri"", ""Rahul Nair"", ""Rajesh Panwar"", ""Rajneesh Suvarna"", ""Ramesh Desai"", ""Ratheesh Nest"", ""Renju TR"", ""Sahana M"", ""Santosh Bs"", ""Selvaganesh K"", ""Shahina Nowshad"", ""Shameem. A.P"", ""shiju Babu"", ""Shwetha Bharathi"", ""siji pk"", ""Sreehari K Mohan"", ""Sriram Reddy"", ""Sudheesh Mohan"", ""Sumesh PB"", ""ullas u r"", ""vadivukkarasi A"", ""VASEN SULI"", ""Vidhya Swaminathan"", ""Vidya Raju"", ""Vijaya Lakshmi"", ""Vinod Ooralath Sivaji"", ""Vinod Shankar"", ""Vivek Puliyeri"", ""Yeray Seminario""]",Pushpa Puliyeri,one was drawn from using a computer-generated random number,India,at least 30 eligible lists with at least five of these shared among three or more birders,,"[""birding, and recording bird sounds as you do"", ""yearlong challenges for 2019""]","[""Verditer Flycatcher""]"
https://birdcount.in/wp-content/uploads/2019/03/21679661-Black-and-Orange-Flycatcher-Bopanna-Pattada-870x580.jpg,April 2019 eBirding Challenge,https://birdcount.in/apr19-challenge/,"It's April and that means breeding has started or will start very soon for many species in most parts of India. What better time to focus on recording the calls and songs that are all around us at this time of year! This month, the challenge focusses on both...","Mar 31, 2019",0 Comments,2 min read,,,,,,"[""Bopanna Pattada""]",,one list containing one or more audio recordings will be drawn at random,India,"a minimum of 30 effort-based, complete checklists of at least 15 minutes duration",one list containing one or more audio recordings,"[""The recording uploaded must be from the time and location of the particular birdlist."", ""The recording must be directly uploaded to eBird, not embedded from third party sites."", ""The recording should be of sufficient quality so that the species in question is identifiable."", ""Please follow the best practices for audio upload when recording and post-processing.""]","[""Black-and-orange Flycatcher""]"
https://birdcount.in/wp-content/uploads/2019/03/140900091-Bluethroat-Sriram-Reddy-mod-870x360.jpg,February 2019 eBirders of the month,https://birdcount.in/feb19-ebirders/,"February is a month of major birding activity, partly due to the Great Backyard Bird Count. Here is the breakup of eBirding in the country in February 2019 (with previous month in brackets): Number of birders: 2,916 (2,378) Number of lists (all types): 47,800...","Mar 17, 2019",0 Comments,2 min read,2916,694000,47800,,,"[""Abhin M"", ""Sunil Abhirami C"", ""Adhithyan NK"", ""ADIL NAFAR"", ""Afthab Faisal k"", ""Aiswaryalakshmi A R"", ""Ajay Gadikar"", ""Amal U S"", ""AM AMSA"", ""Aneesh Sasidevan"", ""Angeline Mano"", ""Anish Aravind"", ""Anup Prakash"", ""Aravind AM"", ""Aravind Amirtharaj"", ""Arun B"", ""Ashwin Viswanathan"", ""Deepti Krishnan"", ""Devika Ps"", ""Dhruba Saikia"", ""Dr. NISHAD PM"", ""Dr.Sandip Modi"", ""Elavarasan M"", ""Gireesan TU"", ""Gopi Sundar"", ""GOVIND GIRIJA"", ""Hareesha AS"", ""hari kumar"", ""Himavat Gouresh"", ""Janardhan Uppada"", ""Jayadev Menon"", ""Jaydev Mandal"", ""JOE M RAJA"", ""krishnakumar K Iyer"", ""Kshitija Gupta"", ""Lakshmikant Neve"", ""Lathika K K"", ""MAXIM RODRIGUES K"", ""MetalClicks Ajay Ashok"", ""Mittal Gala"", ""Mohammed Hirash"", ""Mohanan Choron"", ""Mukundan Kizhakkemadham"", ""Narendran M.M"", ""Niranjana C"", ""Panchapakesan Jeganathan"", ""Pradeepa Sudhakar"", ""Pravar Mourya"", ""Premchand Reghuvaran"", ""Pushpa Puliyeri"", ""Rajesh Radhakrishnan"", ""Raju Kidoor"", ""Ramakrishnan Kumaranallur"", ""Ramesh Desai"", ""Regin Ross"", ""Renju TR"", ""Revathy Reji"", ""Sajeev Krishnan"", ""sajitha siril"", ""Sakthi Chinnakannu"", ""Senan D’Souza"", ""Sheena S"", ""Sohail Madan"", ""Sreehari K Mohan"", ""Sreekumar E R"", ""SRINILA MAHESH K T"", ""Steffin Babu"", ""Subhadra Devi"", ""S – V I S H N U S A N K A R"", ""SYAMILI MANOJ"", ""Tamil Selvan A"", ""vadivukkarasi A"", ""VASEN SULI"", ""Vidhya Sundar"", ""Vidhya Swaminathan"", ""Vineith Malabaricus"", ""Vinod Shankar"", ""Vishnu Sreejith"", ""Vivek Chandran"", ""Vivek Puliyeri""]",Sajitha Siril,All the names listed above were put into a pool and one was drawn from using a computer-generated random number.,India,,excluding group accounts,"[""target for March (birding with others)"", ""yearlong challenges for 2019""]","[""Bluethroat""]"
https://birdcount.in/wp-content/uploads/2019/02/137802061-Himalayan-Monal-Ajit-Hota-crop-870x472.jpg,March 2019 eBirding Challenge,https://birdcount.in/mar19-challenge/,"February was very busy for Indian birders, with all the events, festivals and the GBBC. But let's look ahead to March, and to a new monthly eBirding challenge! Birding is often a social activity, and is a great way to meet others with similar interests, make new...","Feb 28, 2019",0 Comments,2 min read,,,,,,"[""Ajit Hota""]",,,India,"at least 30 effort-based, complete checklists of at least 15 minutes duration. at least 5 of these lists should be ‘shared‘ between two or more birders apart from yourself",,"[""upload all your lists by 14 April 2019"", ""if you are new to eBird, please read this description first"", ""take a look at our quick-start infographic"", ""check out the Beginner’s Guide""]","[""Himalayan Monal""]"
https://birdcount.in/wp-content/uploads/2019/02/135371831-Small-Pratincole-Vyom-Vyas-870x561.jpg,January 2019 eBirders of the month,https://birdcount.in/jan19-ebirders/,"A new year and lots of new birding! Here is the breakup of eBirding in the country in January 2019 (with previous month in brackets): Number of birders: 2,378 (2,002)Number of lists (all types): 33,600 (20,500)Number of observations: 6.04 lakh (4.07 lakh) January...","Feb 18, 2019",6 Comments,2 min read,2378,604000,33600,,,"[""Ameet Mandavia"", ""Angeline Mano"", ""Ankit Badesha"", ""Anup Prakash"", ""Aravind AM"", ""Aravind Amirtharaj"", ""Arun B"", ""Ashwin Viswanathan"", ""Badri Narayanan Thiagarajan"", ""Balaji P B"", ""Bhanu Sridharan"", ""Chirag Munje"", ""Chirag Solanki"", ""Dayani Chakravarthy"", ""dhanapal kondasamy"", ""Dhaval Vargiya"", ""Dhruba Saikia"", ""Divya Subramani"", ""Ganeshwar SV"", ""Hari Harish"", ""Jageshwer verma"", ""Jayadev Menon"", ""Karan Matalia"", ""Korada Rajashekaraiah Niranjan Murthy"", ""Krishna Murthy"", ""krunal trivedi"", ""Lakshmikant Neve"", ""MetalClicks Ajay Ashok"", ""Mike Prince"", ""Murali DC"", ""Prakash G"", ""Ravi naidu"", ""sahithya selvaraj"", ""Santhosh Kshathriya"", ""Selvaraj Rangasamy"", ""SHESHGIRI BAGDE"", ""Sreekumar Chirukandoth"", ""Vidhya Sundar"", ""Vidhya Swaminathan"", ""Vijaya Lakshmi"", ""Yogeswarie Sreedharan""]",Vidhya Swaminathan,drawn from using a computer-generated random number,,survey at least 3 different wetlands and submit the list IDs at the AWC google form,,"[""doing your best to match the target for February (birding during and outside the GBBC)?"", ""there is a new set of yearlong challenges for 2019""]","[""Small Pratincole""]"
https://birdcount.in/wp-content/uploads/2019/01/Eurasian-Hoopoe_Ravi-Naidu-e1548760783784-870x360.jpg,February 2019 eBirding Challenge,https://birdcount.in/feb2019-ebirding-challenge/,Bird with increased frequency over the GBBC period to meet the Feb challenge target.,"Jan 30, 2019",0 Comments,2 min read,1500,,14000,839,,,,,India,"effort-based lists, of at least 15 min duration","upload at least 20 eligible lists during the four days of the GBBC (15-18 Feb), and another 20 eligible lists in the other twenty-four days of February","[""if you are new to eBird, please read this description first"", ""take a look at our quick-start infographic"", ""Beginner’s Guide""]","[""waterbird""]"
https://birdcount.in/wp-content/uploads/2019/01/132338541-Bhaarat-Vyas-870x611.jpg,December 2018 eBirders of the month,https://birdcount.in/dec18-ebirders/,"The last month of the year, but the middle of the winter birding season in India -- here is the breakup of eBirding in the country in December 2018 (with previous month in brackets): Number of birders: 2,002 (1,685)Number of lists (all types): 20,500 (16,200)Number...","Jan 18, 2019",0 Comments,3 min read,2002,407000,20500,,1,"[""Abhinand C"", ""Abhin M Sunil"", ""Abhirami  C"", ""ADIL NAFAR"", ""Afthab Faisal k"", ""Ains Priestman"", ""Ajay  Gadikar"", ""AJU RAJU"", ""Albin Jacob"", ""Amal U S"", ""AM AMSA"", ""Aneesh Sasidevan"", ""Angeline Mano"", ""animesh manna"", ""Anish Aravind"", ""Ankit Vikrant"", ""Anup Prakash"", ""Aravind AM"", ""Arjun R"", ""Arnold Goveas"", ""Arun B"", ""Arun Thomas"", ""Ashwin Viswanathan"", ""Avinash K  Mon"", ""Bhanu Sridharan"", ""Bopanna  Pattada"", ""Chirag Munje"", ""Dayani Chakravarthy"", ""Deepti Krishnan"", ""dhanapal kondasamy"", ""Dhiraj Bhaisare"", ""Dhruba  Saikia"", ""Divya Mudappa"", ""Dr George P J"", ""Elavarasan M"", ""Emanuel george"", ""fermin jose"", ""Ganeshwar  S V"", ""Gireesan TU"", ""GIRISHKUMAR K"", ""Gopi Sundar"", ""GOVIND GIRIJA"", ""habeel sahal"", ""Hakimuddin F Saify"", ""Hareesha  AS"", ""hari kumar"", ""HARI MAVELIKARA"", ""Harsha Jayaramaiah"", ""Harshith JV"", ""HARSHJEET BAL"", ""HG Prashanthakumar"", ""Himavat Gouresh"", ""Jageshwer verma"", ""Janardhan Uppada"", ""Jayadev  Menon"", ""Jinesh P S"", ""JOE MRAJA"", ""Karunakar  Rayker"", ""Kedar Champhekar"", ""krishnakumar K Iyer"", ""Krishna Murthy"", ""krunal trivedi"", ""Kshitija Gupta"", ""Kumar RR"", ""Lakshmikant Neve"", ""Lekshmi Jayakumar"", ""Lloyd Fernandes"", ""Manju Sinha"", ""manoj p g"", ""MAXIM RODRIGUES K"", ""Mehala Kumar"", ""MetalClicks Ajay Ashok"", ""Mittal Gala"", ""Mohammed Sayeer"", ""Mohanan Choron"", ""Narendran M.M"", ""Niranjana C"", ""Panchapakesan Jeganathan"", ""Periyasamy Rajangam"", ""Pradeepa Sudhakar"", ""Prashanth N S"", ""Praver Mourya"", ""Premchand Reghuvaran"", ""PRIYA AV"", ""Pushpa Puliyeri"", ""rahul narlanka"", ""Rajesh Radhakrishnan"", ""rakesh ahlawat"", ""Ramesh Desai"", ""renju tr"", ""Roozbeh Gazdar"", ""Sahana M"", ""Sajeev Krishnan"", ""sajitha siril"", ""Sandhya Lenka"", ""sasidharan manekkara"", ""Selvaganesh K"", ""Selvaraj Rangasamy"", ""Sheena S"", ""Sherin James"", ""Shilpa Gadgil"", ""Shwetha Bharathi"", ""Sreekumar Chirukandoth"", ""Sreekumar E R"", ""Steffin Babu"", ""Subbu Subramanya"", ""Subhadra Devi"", ""Sudheesh Mohan"", ""SYAMILI MANOJ"", ""Tamil Selvan A"", ""tanuja dasharath haunsbhavi"", ""Thomas Job"", ""T R Shankar Raman"", ""Tubin Babu"", ""VASEN SULI"", ""Vidhya Sundar"", ""Vidhya Swaminathan"", ""Vijaya Lakshmi"", ""Vinay Bharadwaj"", ""Vinay Bhat"", ""Vinay Nadig"", ""Vineeth Malabaricus"", ""Vinod Shankar"", ""Vivek Puliyeri""]",George P J,"All the checklists of those named above were put into a pool and one list
with uploaded media
was drawn from this pool using a computer-generated random number.",India,upload at least 30 eligible lists during the month,list with uploaded media,"[""match the target for January (AWC counts at at least three different wetlands)"", ""there is a new set of yearlong challenges for 2019""]","[""Ruddy Turnstone""]"
https://birdcount.in/wp-content/uploads/2018/12/Basai-Wetland_Anil-T-870x402.jpg,January 2019 eBirding Challenge,https://birdcount.in/jan19-challenge/,The challenge this month is to contribute to the national effort towards the AWC.,"Dec 31, 2018",3 Comments,2 min read,,,,,,,,,India,"Effort-based, complete checklist of a minimum of 15 minutes from at least 3 different wetlands",Share your checklist with the eBird username: awcindia; fill in the AWC Site Information Form,"[""The 15 min guideline is only a minimum: you should ideally take as much time as is needed to cover the wetland in total."", ""All users shared on the list(s) contributed to the AWC Site Information Form will also be eligible for the challenge."", ""Recommended dates are 5-20 January, but counts from any date in the month are eligible for the challenge."", ""Upload all your lists (and fill out the google form) by 14 February 2019 so that we can announce the results on the 16th.""]","[""Waterfowl"", ""Flamingo""]"
https://birdcount.in/wp-content/uploads/2018/12/124237891-STSE-Rajdeep-Mitra-870x580.jpg,November 2018 eBirders of the Month,https://birdcount.in/nov18-ebirders/,"As we enter the main winter birding season in India, here is the breakup of eBirding in the country in November 2018 (with previous month in brackets): Number of birders: 1,685 (1,528) Number of lists (all types): 16,200 (15,400) Number of observations: 3.31 lakh...","Dec 7, 2018",0 Comments,2 min read,1685,331000,16200,,,"[""Abhirami C"", ""Adharsh Bharathi"", ""ADIL NAFAR"", ""Ajay Gadikar"", ""Ankit Vikrant"", ""Anup Prakash"", ""Aravind AM"", ""Arnold Goveas"", ""Arun B"", ""Arun Thomas"", ""Aruvi Poomali"", ""Ashish Loya"", ""Ashwin Viswanathan"", ""Avishkar Munje"", ""B.R. Ansil"", ""Chirag Munje"", ""Deepti Krishnan"", ""Dhruba Saikia"", ""Elavarasan M"", ""Emanuel george"", ""Ganeshwar S V"", ""Gireesan TU"", ""GOVIND GIRIJA"", ""Gurpartap Singh"", ""Hareesha AS"", ""HARSHJEET BAL"", ""HG Prashanthakumar"", ""JANANI L"", ""Janardhan Uppada"", ""Jayadev Menon"", ""Karunakar Rayker"", ""Kaushik Sarkar"", ""Kiranmayee K"", ""krishnakumar K Iyer"", ""Kshitija Gupta"", ""Lakshmikant Neve"", ""Manju Sinha"", ""MetalClicks Ajay Ashok"", ""Mittal Gala"", ""Neel Gadikar"", ""Panchapakesan Jeganathan"", ""Praver Mourya"", ""Premchand Reghuvaran"", ""Pushpa Puliyeri"", ""Rajesh Radhakrishnan"", ""Ramesh Desai"", ""renju tr"", ""Sajeev Krishnan"", ""Sandhya Lenka"", ""Selvaraj Rangasamy"", ""Sherin James"", ""Sreekumar Chirukandoth"", ""Sreekumar E R"", ""Steffin Babu"", ""Subhadra Devi"", ""Tamil Selvan A"", ""VASEN SULI"", ""Vidhya Sundar"", ""Vidhya Swaminathan"", ""Vijaya Lakshmi"", ""Vinay Bhat"", ""Vinay Nadig"", ""Vinod Shankar"", ""Vivek Chandran"", ""vrinda lath""]",Govind Girija,computer-generated random number,India,at least 11 eligible each in the first and second halves of the month,at least 11 of all lists to be from  single location,"[""Are you doing your best to match the target for December (30 lists, ideally with media)?"", ""this is the last chance to work towards the yearlong challenges for 2018""]","[""Short-toed Snake Eagle""]"
